{
  "id": "wf-demo-1",
  "name": "Demo Workflow: Trigger Test",
  "description": "Testing the manual trigger",
  "updated_at": "2025-11-23T22:10:00.000000",
  "nodes": [
    {
      "id": "trigger-1",
      "position": {
        "x": 100,
        "y": 100
      },
      "data": {
        "label": "Manual Trigger",
        "type": "trigger-manual"
      },
      "type": "default",
      "style": {
        "background": "#ffffff",
        "border": "2px solid #3b82f6",
        "borderRadius": "12px",
        "padding": "16px",
        "minWidth": "200px",
        "textAlign": "left",
        "color": "#1e293b",
        "boxShadow": "0 4px 6px -1px rgba(0, 0, 0, 0.1)",
        "fontFamily": "Inter, sans-serif"
      },
      "width": 200,
      "height": 52
    }
  ],
  "edges": []
}